{
  "$schema": "http://json-schema.org/draft-07/schema#",
  "$id": "vulnerability_report.schema.json",
  "definitions": {
    "nvd_data_entry": {
      "type": "object",
      "properties": {
        "cvss_v2": {
          "type": "object",
          "properties": {
            "additional_information": {
              "type": "object",
              "properties": {
                "ac_insuf_info": {
                  "type": ["null","boolean"]
                },
                "obtain_all_privilege": {
                  "type": "boolean"
                },
                "obtain_other_privilege": {
                  "type": "boolean"
                },
                "obtain_user_privilege": {
                  "type": "boolean"
                },
                "user_interaction_required": {
                  "type": "boolean"
                }
              }
            },
            "base_metrics": {
              "type": "object",
              "properties": {
                "access_complexity": {
                  "type": "string"
                },
                "access_vector": {
                  "type": "string"
                },
                "authentication": {
                  "type": "string"
                },
                "availability_impact": {
                  "type": "string"
                },
                "base_score": {
                  "type": "number"
                },
                "confidentiality_impact": {
                  "type": "string"
                },
                "exploitability_score": {
                  "type": "number"
                },
                "impact_score": {
                  "type": "number"
                },
                "integrity_impact": {
                  "type": "string"
                }
              }
            },
            "severity": {
              "type": "string"
            },
            "vector_string": {
              "type": "string"
            },
            "version": {
              "type": "string"
            }
          }
        },
        "cvss_v3": {
          "type": "object",
          "properties": {
            "base_metrics": {
              "type": "object",
              "properties": {
                "attack_complexity": {
                  "type": "string"
                },
                "attack_vector": {
                  "type": "string"
                },
                "availability_impact": {
                  "type": "string"
                },
                "base_score": {
                  "type": "number"
                },
                "base_severity": {
                  "type": "string"
                },
                "confidentiality_impact": {
                  "type": "string"
                },
                "exploitability_score": {
                  "type": "number"
                },
                "impact_score": {
                  "type": "number"
                },
                "integrity_impact": {
                  "type": "string"
                },
                "privileges_required": {
                  "type": "string"
                },
                "scope": {
                  "type": "string"
                },
                "user_interaction": {
                  "type": "string"
                }
              }
            },
            "vector_string": {
              "type": "string"
            },
            "version": {
              "type": "string"
            }
          }
        },
        "id": {
          "type": "string"
        }
      }
    },
    "cpe_entry": {
      "type": "object",
      "properties": {
        "cpe": {
          "type": "string"
        },
        "cpe23": {
          "type": "string"
        },
        "feed_name": {
          "type": "string"
        },
        "feed_namespace": {
          "type": "string"
        },
        "fixed_in": {
          "type": "array"
        },
        "link": {
          "type": "string"
        },
        "name": {
          "type": "string"
        },
        "nvd_data": {
          "type": "array",
          "items": {
            "$ref": "#/definitions/nvd_data_entry"
          }
        },
        "pkg_path": {
          "type": "string"
        },
        "pkg_type": {
          "type": "string"
        },
        "severity": {
          "type": "string"
        },
        "vendor_data": {
          "type": "array"
        },
        "version": {
          "type": "string"
        },
        "vulnerability_id": {
          "type": "string"
        }
      }
    },
    "cpe_report": {
      "type": "array",
      "items": {
        "$ref": "#/definitions/cpe_entry"
      }
    },
    "legacy_table": {
      "type": "object",
      "required": ["colcount", "header", "rowcount", "rows"],
      "properties": {
        "colcount": {
          "$ref": "#/definitions/legacy_table_colcount"
        },
        "header": {
          "$ref": "#/definitions/legacy_table_header"
        },
        "rowcount": {
          "$ref": "#/definitions/legacy_table_rowcount"
        },
        "rows": {
          "$ref": "#/definitions/legacy_table_rows"
        }
      }
    },
    "legacy_table_colcount": {
      "type": "number"
    },
    "legacy_table_header": {
      "type": "array",
      "items": {
        "type": "string"
      }
    },
    "legacy_table_rowcount": {
      "type": "number"
    },
    "legacy_table_rows": {
      "type": "array",
      "items": {
        "type": "array",
        "items": [
          {
            "type": "string"
          },
          {
            "type": "string"
          },
          {
            "type": "number"
          },
          {
            "type": "string"
          },
          {
            "type": "string"
          },
          {
            "type": "string"
          },
          {
            "type": "string"
          },
          {
            "type": "string"
          },
          {
            "type": "string"
          },
          {
            "type": "string"
          },
          {
            "type": "string"
          },
          {
            "type": "string"
          },
          {
            "type": "string"
          },
          {
            "type": "string"
          },
          {
            "type": "string"
          }
        ]
      }
    },
    "legacy_report": {
      "type": "object",
      "required": ["multi"],
      "properties": {
        "multi": {
          "type": "object",
          "required": ["result", "url_column_index", "warns"],
          "properties": {
            "result": {
              "$ref": "#/definitions/legacy_table"
            },
            "url_column_index": {
              "type": "number"
            },
            "warns": {
              "type": "array"
            }
          }
        }
      }
    }
  },
  "type": "object",
  "required": ["cpe_report", "image_id", "legacy_report", "user_id"],
  "properties": {
    "cpe_report": {
      "$ref": "#/definitions/cpe_report"
    },
    "image_id": {
      "type": "string"
    },
    "legacy_report": {
      "$ref": "#/definitions/legacy_report"
    },
    "user_id": {
      "type": "string"
    }
  }
}