{"cpe_report": [], "image_id": "28f6e27057430ed2a40dbdd50d2736a3f0a295924016e294938110eeb8439818", "legacy_report": {"multi": {"result": {"colcount": 15, "header": ["CVE_ID", "Severity", "*Total_Affected", "Vulnerable_Package", "Fix_Available", "Fix_Images", "Rebuild_Images", "URL", "Package_Type", "Feed", "Feed_Group", "Package_Name", "Package_Path", "Package_Version", "CVES"], "rowcount": 0, "rows": []}, "url_column_index": 7, "warns": []}}, "user_id": "admin"}